审判者蓝图	1
震荡电容器单元蓝图	1408
碳化晶体附甲蓝图	3898
标量电容器单元蓝图	214
迪波特钛合金附甲蓝图	5672
碳化菲尔金属合成物附甲蓝图	807
电解电容器单元蓝图	663
聚变推进器蓝图	1
超立方电容器单元蓝图	1895
雷达感应器组蓝图	28
纳米电子微处理器蓝图	74
碳化钨附甲蓝图	11436
线性护盾能量发射器蓝图	1
惩罚者级蓝图	10
镰刀级蓝图	3
鱼鹰级蓝图	4
狂怒者级蓝图	1
狐鼬级蓝图	3
魔符级蓝图	4
埃比斯级蓝图	5
猛犸级蓝图	1
旗舰跳跃引擎蓝图	1
妄想级蓝图	5
回旋者级蓝图	7
乌鸦级蓝图	3
阿尔格斯级蓝图	10
超导引力传感器集群蓝图	38
五面体电容器处理器蓝图	76
多彩装甲附甲板蓝图	5459
纳米晶体管反应配方	20
碳化晶体反应配方	27
富勒化合物反应配方	273
多晶碳化硅纤维反应配方	50
碳化钛反应配方	87
菲尔合金碳化物反应配方	187
碳化钨反应配方	112
核心温度调节器蓝图	3
生命保障备份装置蓝图	42
自动修复储藏装置密封蓝图	85
强化碳纤维反应配方	40
硫酸反应配方	64
新汞合金反应配方	10
微晶合金反应配方	13
碳聚合物反应配方	128
六元复合物反应配方	25
陶瓷粉末反应配方	75
二硼硅反应配方	84
铬化钛反应配方	43
菲尔合金反应配方	79
轧制钨合金反应配方	35
钷汞合金反应配方	9
碳纤维反应配方	54
富氧有机溶剂反应配方	4
热固性聚合物反应配方	52
