小型护盾扩展装置蓝图 II	1
护盾回充器蓝图 II	7
采矿调查芯片组蓝图 II	10
虚空蓝图 S	16
钉刺蓝图 S	6
涅槃蓝图 S	63
极光蓝图 S	24
灼烧蓝图 S	51
爆燃蓝图 S	80
微光蓝图 S	18
电容回充器蓝图 II	84
鞭挞狂乱火箭蓝图	12
鞭挞标枪火箭蓝图	5
电容通量线圈蓝图 II	3
多谱式涂层蓝图 II	52
扩充货柜舱蓝图 II	91
强化舱隔壁蓝图 II	54
雷神狂乱鱼雷蓝图	2
纳米纤维内部构架蓝图 II	242
中型远程护盾回充增量器蓝图 II	4
中型引力子立体炸弹蓝图 II	1
200mm钢附甲板蓝图 II	6
普通小行星采集晶体C型蓝图 II	11
中型处理器超频组件蓝图 I	26
大型处理器超频组件蓝图 I	2
大型爆炸装甲强化装置蓝图 I	3
大型液压舱推进器蓝图 I	1
大型电磁护盾强化装置蓝图 I	3
大型热能护盾强化装置蓝图 I	1
小型处理器超频组件蓝图 I	76
小型远程维修增效器蓝图 I	3
小型三角装甲聚合器蓝图 I	34
旗舰级三角装甲聚合器蓝图 I	2
小型爆炸装甲强化装置蓝图 I	3
中型爆炸装甲强化装置蓝图 I	9
小型辅助纳米聚合器蓝图 I	10
中型三角装甲聚合器蓝图 I	58
小型打捞回收工具蓝图 I	11
小型辅助推进器蓝图 I	23
中型货柜舱优化改造蓝图 I	24
小型复合碳素引擎舱蓝图 I	32
中型复合碳素引擎舱蓝图 I	10
小型放射范围约束装置蓝图 I	11
小型引力电容器升级蓝图 I	118
小型弥集进化演算法数据库蓝图 I	12
中型信号干扰增效装置蓝图 I	1
小型粒子散布投放器蓝图 I	14
中型粒子散布投放器蓝图 I	1
中型信号集中设备蓝图 I	1
小型锁定系统辅助控制器蓝图 I	5
中型跟踪诊断子程序蓝图 I	7
小型辅助电源路由器蓝图 I	44
中型辅助电源路由器蓝图 I	52
小型冷凝能量管理单元蓝图 I	6
小型能量武器发散调节装置蓝图 I	3
小型能量武器冲击加速器蓝图 I	3
小型能量武器轨迹校准设备蓝图 I	8
中型能量武器轨迹校准设备蓝图 I	1
小型冷凝混合管理单元蓝图 I	6
小型混合武器射速调节装置蓝图 I	7
小型混合武器冲击加速器蓝图 I	10
小型弹头加热辅助系统蓝图 I	12
中型射弹武器范围扩大装置蓝图 I	1
中型射弹武器轨迹校准设备蓝图 I	2
小型电磁护盾强化装置蓝图 I	62
中型电磁护盾强化装置蓝图 I	41
小型爆炸护盾强化装置蓝图 I	1
中型爆炸护盾强化装置蓝图 I	5
小型动能护盾强化装置蓝图 I	3
小型热能护盾强化装置蓝图 I	38
中型热能护盾强化装置蓝图 I	17
小型核心防御电容器安全管理装置蓝图 I	5
中型核心防御电容器安全管理装置 I 蓝图	2
小型核心防御节能装置蓝图 I	7
小型核心防御力场扩张装置蓝图 I	121
中型核心防御力场扩张装置蓝图 I	136
小型核心防御力场稳固装置蓝图 I	4
中型冰矿采集器加速器蓝图 I	1
小型横贯舱壁蓝图 I	46
中型横贯舱壁蓝图 I	13
大型横贯舱壁蓝图 I	2
小型指挥处理器蓝图 I	9
中型指挥处理器蓝图 I	10
小型处理器超频组件蓝图 II	12
小型三角装甲聚合器蓝图 II	6
小型热能装甲强化装置蓝图 II	3
小型辅助推进器蓝图 II	10
小型低摩擦喷嘴接口蓝图 II	24
中型低摩擦喷嘴接口蓝图 II	6
小型超空间速度调节器蓝图 II	70
小型复合碳素引擎舱蓝图 II	30
小型引力电容器升级蓝图 II	10
小型离子力场投射器蓝图 II	10
小型粒子散布投放器蓝图 II	2
中型粒子散布投放器蓝图 II	1
小型信号集中设备蓝图 II	1
小型锁定系统辅助控制器蓝图 II	2
中型锁定系统辅助控制器蓝图 II	1
小型辅助电源路由器蓝图 II	13
小型电容器控制电路蓝图 II	4
小型能量武器发散调节装置蓝图 II	11
小型能量武器冲击加速器蓝图 II	5
小型能量武器轨迹校准设备蓝图 II	14
中型能量武器轨迹校准设备蓝图 II	8
小型混合武器射速调节装置蓝图 II	7
小型混合武器冲击加速器蓝图 II	1
小型混合武器轨迹校准设备蓝图 II	4
小型装卸加速装置蓝图 II	10
小型液压舱推进器蓝图 II	11
小型火箭燃料缓冲隔离装置蓝图 II	5
小型射弹武器射速调节装置蓝图 II	4
小型电磁护盾强化装置蓝图 II	40
中型电磁护盾强化装置蓝图 II	12
小型爆炸护盾强化装置蓝图 II	1
小型动能护盾强化装置蓝图 II	3
小型热能护盾强化装置蓝图 II	10
小型核心防御力场扩张装置蓝图 II	45
小型核心防御力场稳固装置蓝图 II	3
小型横贯舱壁蓝图 II	16
